{
    "id": "minecraft:cube_column",
    "preview": "cube_column.json",
    "blockstates": [
        "normal", "directional", "horizontal", "pillar", "dirt"
    ],
    "textures": [
        "end", "side"
    ],
    "models": {
        "block": {
            "name": "block/${id}",
            "template": "cube_column.json"
        }
    }
}