{
    "id": "minecraft:cube",
    "preview": "cube.json",
    "blockstates": [
        "normal", "directional", "horizontal", "dirt"
    ],
    "textures": [
        "top", "bottom", "north", "south", "west", "east"
    ],
    "models": {
        "block": {
            "name": "block/${id}",
            "template": "cube.json"
        }
    }
}