{
    "id": "minecraft:pane",
    "preview": "pane.json",
    "blockstates": [
        "pane"
    ],
    "textures": [
        "pane", "edge"
    ],
    "models": {
        "pane_post": {
            "name": "block/${id}_post",
            "template": "pane_post.json"
        },
        "pane_side": {
            "name": "block/${id}_side",
            "template": "pane_side.json"
        },
        "pane_side_alt": {
            "name": "block/${id}_side_alt",
            "template": "pane_side_alt.json"
        },
        "pane_noside": {
            "name": "block/${id}_noside",
            "template": "pane_noside.json"
        },
        "pane_noside_alt": {
            "name": "block/${id}_noside_alt",
            "template": "pane_noside_alt.json"
        }
    }
}