{
    "id": "minecraft:wall",
    "preview": "wall.json",
    "blockstates": [
        "wall"
    ],
    "textures": [
        "texture"
    ],
    "models": {
        "wall_post": {
            "name": "block/${id}_post",
            "template": "wall_post.json"
        },
        "wall_side": {
            "name": "block/${id}_side",
            "template": "wall_side.json"
        },
        "wall_inventory": {
            "name": "block/${id}_inventory",
            "template": "wall_inventory.json"
        }
    }
}