{
    "id": "minecraft:cube_bottom_top",
    "preview": "cube_bottom_top.json",
    "blockstates": [
        "normal", "directional", "horizontal", "dirt"
    ],
    "textures": [
        "bottom", "top", "side"
    ],
    "models": {
        "block": {
            "name": "block/${id}",
            "template": "cube_bottom_top.json"
        }
    }
}