{
    "id": "minecraft:stone",
    "preview": "cube.json",
    "blockstates": [
        "stone"
    ],
    "textures": [
        "top", "bottom", "north", "south", "west", "east"
    ],
    "models": {
        "block": {
            "name": "block/${id}",
            "template": "cube.json"
        },
        "block_mirrored": {
            "name": "block/${id}_mirrored",
            "template": "cube_mirrored.json"
        }
    }
}